Question,QuestionEnglish,ChoiceA,ChoiceAEnglish,ChoiceB,ChoiceBEnglish,ChoiceC,ChoiceCEnglish,CorrectAnswer,Period
Hvem er medlem af et samarbejdsudvalg?,Who is a member of a cooperation committee?,Repræsentanter for medarbejdere og ledelse,Representatives of employees and management,Repræsentanter for staten og kommunerne,Representatives of the state and municipalities,Repræsentanter for kommunerne og virksomhederne,Representatives of municipalities and businesses,Repræsentanter for medarbejdere og ledelse,2018 Sommer
Hvad hedder Danmarks forfatning?(2),What is the name of Denmark's constitution?,Valgloven,,Grundloven,,Kongeloven,,Grundloven,2018 Sommer
Hvornår fik kvinder stemmeret til Folketinget?,When did women get the right to vote in parliament?,I 1915,,I 1945,,I 1975,,I 1915,2018 Sommer
Hvor gammel skal man normalt være for at blive gift i Danmark?(2),How old do you usually have to be to get married in Denmark?,Mindst 15 år,,Mindst 18 år,,Mindst 21 år,,Mindst 18 år,2018 Sommer
Er det gratis at låne bøger på landets folkebiblioteker?(4),Is it free to borrow books at the country's public libraries?,Ja,,Nej,,,,Ja,2018 Sommer
Hvem har den dømmende magt?(3),Who has the judicial power?,Folketinget,Parliament,Regeringen,Government,Domstolene,The courts,Domstolene,2018 Sommer
Kan to personer fra to forskellige trossamfund blive gift i folkekirken?,Can two people from two different religious communities get married in the Danish National Church?,"Nej, begge personer skal være medlem af folkekirken","No, both people must be members of the Danish National Church.","Ja, hvis den ene person er medlem af folkekirken","Yes, if one person is a member of the Danish National Church.",,,"Ja, hvis den ene person er medlem af folkekirken",2018 Sommer
Hvor mange kommuner er der i Danmark?(5),How many municipalities are there in Denmark?,68,,98,,128,,98,2018 Sommer
Hvad er en straffeattest?(4),What is a criminal record?,"Et dokument, man skal udfylde, hvis man ønsker at blive dansk statsborger",A document you must fill out if you want to become a Danish citizen,"Et dokument, man skal vise til politiet, hvis man bliver anholdt",A document you must show to the police if you are arrested,"Et dokument, der viser, om man har været straffet",A document showing whether you have been punished,"Et dokument, der viser, om man har været straffet",2018 Sommer
Hvor mange medlemmer af Folketinget er valgt i Grønland?(3),How many members of the parliament are elected in Greenland?,2,,4,,6,,2,2018 Sommer
Hvilken af følgende virksomheder producerer vindmøller?(4),Which of the following companies manufactures wind turbines?,Novo Nordisk,,Vestas,,Arla,,Vestas,2018 Sommer
Er det forbudt at slå børn i Danmark?(3),Is it forbidden to hit children in Denmark?,Ja,,Nej,,,,Ja,2018 Sommer
Hvilken organisation blev Danmark medlem af i 1945?(4),Which organization did Denmark become a member of in 1945?,EU,,FN,,NATO,,FN,2017 Vinter
Hvad er normalt ikke gratis for voksne i Danmark?(2),What is not usually free for adults in Denmark?,At gå til læge,,At komme på hospitalet,,At gå til tandlæge,,At gå til tandlæge,2017 Vinter
Hvor højt er Danmarks højeste geografiske punkt?(2),How high is Denmark's highest geographical point?,Ca. 590 meter,,Ca. 380 meter,,Ca. 170 meter,,Ca. 170 meter,2017 Vinter
Hvilke lande er der i det danske rigsfællesskab?,Which countries are in the Danish Realm?,"Danmark, Grønland og Færøerne",,"Danmark, Island og Norge",,,,"Danmark, Grønland og Færøerne",2017 Vinter
"Hvad hedder den karakterskala, der anvendes i det danske uddannelsessystem?",What is the name of the grading scale used in the Danish education system?,13-trinsskalaen,,10-trinsskalaen,,7-trinsskalaen,,7-trinsskalaen,2017 Vinter
Hvor mange medlemmer har Danmark i Europa-Parlamentet?(2),How many members does Denmark have in the European Parliament?,13,,23,,33,,13,2017 Vinter
Hvem har den lovgivende magt?(2),Who has the legislative power?,Regeringen og Parliament,The Government and the Folketing,Folketinget og domstolen,The Parliament and the Court,,,Regeringen og Parliament,2017 Vinter
Hvem har normalt ansvaret for de offentlige børnehaver?,Who is usually responsible for public kindergartens?,Staten,,Regionerne,,Kommunerne,,Kommunerne,2017 Vinter
Hvilken rettighed fik kvinder i 1915?,What rights did women gain in 1915?,Retten til at stemme til den lovgivende forsamling,The right to vote for the Legislative Assembly,Retten til at få en abort til og med 12. graviditetsuge,The right to have an abortion up to and including the 12th week of pregnancy,Retten til at blive skilt fra en voldelig ægtemand,The right to divorce an abusive husband,Retten til at stemme til den lovgivende forsamling,2017 Vinter
Hvilket land blev Danmark besat af den 9. april 1940?(3),"Which country was Denmark occupied by on April 9, 1940?",England,,Tyskland,,Sverige,,Tyskland,2017 Vinter
Hvor mange procent af lønmodtagerne i Danmark er medlem af en a-kasse?(2),What percentage of employees in Denmark are members of an unemployment insurance fund?,Ca. 30 %,,Ca. 50 %,,Ca. 70 %,,Ca. 70 %,2017 Vinter
I forbindelse med hvilken mærkedag er der tradition for at brænde bål?,In connection with which anniversary is there a tradition of lighting a bonfire?,Sankt Hans,,Halloween,,Fastelavn,,Sankt Hans,2017 Vinter
Hvornår er grundloven senest blevet ændret?,When was the Constitution last amended?,1853,,1903,,1953,,1953,2017 Vinter
"Hvordan bliver det afgjort, hvem der skal være konge eller dronning i Danmark?(4)",How is it decided who will be king or queen in Denmark?,Folketinget vælger den bedst kvalificerede,The Folketing selects the best qualified,Den nye konge eller dronning arver tronen,The new king or queen inherits the throne,Det bliver afgjort gennem en folkeafstemning,It will be decided through a referendum.,Den nye konge eller dronning arver tronen,2017 Vinter
Hvor mange medlemmer har Folketinget?(4),How many members does the parliament have?,59,,119,,179,,179,2017 Vinter
Hvad er et samarbejdsudvalg?,What is a works council?,Et samarbejde i en virksomhed mellem ledelsen og de ansatte,A collaboration in a company between management and employees,Et samarbejde mellem ledere i det offentlige og private,A collaboration between leaders in the public and private sectors,,,Et samarbejde i en virksomhed mellem ledelsen og de ansatte,2017 Vinter
Hvad fremstiller den danske virksomhed LEGO?(3),What does the Danish company LEGO manufacture?,Insulin,,Vindmøller,,Byggeklodser,,Byggeklodser,2017 Vinter
Kan man få dagpenge ved arbejdsløshed uden at være medlem af en arbejdsløshedskasse?(2),Can you receive unemployment benefits without being a member of an unemployment fund?,Nej,,Ja,,,,Nej,2017 Vinter
Hvor mange ugers fædreorlov har fædre ret til efter fødslen?,How many weeks of paternity leave are fathers entitled to after giving birth?,Ingen,,2 uger,,4 uger,,2 uger,2017 Vinter
Hvem er den øverste politiske leder af en kommune?(4),Who is the top political leader of a municipality?,En major,,En borgmester,,En kommunaldirektør,,En borgmester,2017 Vinter
Hvad er P.S. Krøyer særlig kendt for?(3),What is P.S. Krøyer particularly known for?,Han var forfatter,He was a writer,Han var komponist,He was a composer,Han var kunstmaler,He was a painter,Han var kunstmaler,2017 Vinter
"Hvem bestemmer, hvornår der skal udskrives valg til Folketinget?",Who decides when elections to the parliament should be called?,Folketingets formand,Speaker of the Parliament,Statsministeren,The Prime Minister,,,Statsministeren,2017 Vinter
Hvilke områder mistede Danmark i 1864?,What territories did Denmark lose in 1864?,Island og Norge,,"Skåne, Halland og Blekinge",,Slesvig og Holsten,,"Skåne, Halland og Blekinge",2017 Vinter
Hvad er en kollektiv overenskomst?(2),What is a collective agreement?,En aftale mellem fagforeninger og arbejdsgivere,An agreement between unions and employers,"En aftale mellem staten, regionerne og kommunerne","An agreement between the state, the regions and the municipalities",En aftale mellem virksomheder og kommunalbestyrelser,An agreement between companies and local governments,En aftale mellem fagforeninger og arbejdsgivere,2017 Vinter
"Betyder en betinget fængselsstraf, at man skal direkte i fængsel?(4)",Does a suspended prison sentence mean that you go straight to prison?,Ja,,Nej,,,,Nej,2017 Vinter
Er Danmark medlem af NATO?(4),Is Denmark a member of NATO?,Ja,Yes,Nej,No,,,Ja,2017 Sommer
Hvor i Danmark ligger Aarhus?,Where in Denmark is Aarhus located?,På Sjælland,In Zealand,I Jylland,In Jutland,På Fyn,In Funen,I Jylland,2017 Sommer
Hvornår er Danmarks Riges Grundlov fra?(2),When is the Constitution of the Kingdom of Denmark from?,1661,,1788,,1849,,1849,2017 Sommer
Hvor mange regioner er Danmark opdelt i?(2),How many regions is Denmark divided into?,5,,7,,9,,5,2017 Sommer
"DA og LO indgår aftaler for store dele af arbejdsmarkedet. Aftalerne drejer sig om fx løn, arbejdstid og ferie. Hvad hedder disse aftaler?","DA and LO enter into agreements for large parts of the labor market. The agreements concern, for example, pay, working hours and vacation. What are these agreements called?",Arbejdspladsvurderinger,Workplace assessments,Kollektive overenskomster,Collective agreements,,,Kollektive overenskomster,2017 Sommer
"I 1700-tallet blev der gennemført nogle reformer. De betød blandt andet, at bønderne selv kunne bestemme, hvor de ville arbejde og bo. Hvilke reformer er der tale om?","In the 18th century, some reforms were implemented. Among other things, they meant that the farmers could decide for themselves where they wanted to work and live. What reforms are these?",Landboreformer,Land reforms,Velfærdsreformer,Welfare reforms,Kommunalreformer,Municipal reforms,Landboreformer,2017 Sommer
Hvad markeres hvert år den 5. maj?,What is celebrated every year on May 5th?,Genforeningen af Sønderjylland med Danmark,The reunification of Southern Jutland with Denmark,Indførelsen af Danmarks Riges Grundlov,The introduction of the Constitution of the Kingdom of Denmark,Befrielsen af Danmark efter Anden Verdenskrig,The liberation of Denmark after World War II,Befrielsen af Danmark efter Anden Verdenskrig,2017 Sommer
Hvor mange års undervisningspligt er der i Danmark?(2),How many years of compulsory education are there in Denmark?,7 år,7 years,10 år,10 years,12 år,12 years,10 år,2017 Sommer
Hvornår kan man tidligst få SU (Statens Uddannelsesstøtte)?,When is the earliest you can receive SU (State Education Support)?,Når man fylder 15 år,When you turn 15,Når man fylder 18 år,When you turn 18,Når man fylder 21 år,When you turn 21,Når man fylder 18 år,2017 Sommer
Hvor ofte skal der ifølge grundloven afholdes Folketingsvalg?(3),How often must parliamentary elections be held according to the Constitution?,Mindst hvert 3. år,At least every 3 years,Mindst hvert 4. år,At least every 4 years,Mindst hvert 5. år,At least every 5 years,Mindst hvert 4. år,2017 Sommer
Er vaccinationer mod børnesygdomme gratis?,Are vaccinations against childhood diseases free?,Ja,Yes,Nej,No,,,Ja,2017 Sommer
Hvad er et samarbejdsudvalg?(2),What is a works council?,Et samarbejde i en virksomhed mellem ledelsen og de ansatte,A collaboration in a company between management and employees,Et samarbejde mellem ledere i det offentlige og private,A collaboration between leaders in the public and private sectors,,,Et samarbejde i en virksomhed mellem ledelsen og de ansatte,2017 Sommer
Hvilken instans står normalt for driften af de offentlige børnehaver og vuggestuer?,Which agency is normally responsible for the operation of public kindergartens and nurseries?,Staten,The state,Regionerne,The regions,Kommunerne,The municipalities,Kommunerne,2017 Sommer
"Hvor gamle skal unge være, før de må købe vin og øl?",How old do young people have to be before they can buy wine and beer?,16 år,16 y/o,18 år,18 y/o,20 år,20 y/o,16 år,2017 Sommer
Hvilken arkitekt har tegnet Danmarks Nationalbank i København?,Which architect designed the National Bank of Denmark in Copenhagen?,Jørn Utzon,,Arne Jacobsen,,Henning Larsen,,Arne Jacobsen,2017 Sommer
"Må en arbejdsgiver fyre en kvinde, fordi hun er gravid?(4)",Can an employer fire a woman because she is pregnant?,Ja,Yes,Nej,No,,,Nej,2017 Sommer
Hvad er det danske firma Novo Nordisk særlig kendt for at producere?(2),What is the Danish company Novo Nordisk particularly known for producing?,Høreapparater,Hearing aids,Vindmøller,Wind turbines,Medicin,Medicine,Medicin,2017 Sommer
Har kvinder normalt mulighed for at få økonomisk støtte under barselsorlov?,Do women usually have the opportunity to receive financial support during maternity leave?,Ja,Yes,Nej,No,,,Ja,2017 Sommer
Har en medarbejder altid krav på at arbejde på deltid?,Is an employee always entitled to work part-time?,Ja,,Nej,,,,Nej,2017 Sommer
Hvor mange medlemmer vælger Danmark til Europa-Parlamentet?,How many members does Denmark elect to the European Parliament?,13,,23,,33,,13,2017 Sommer
Hvem var Danmarks første kvindelige statsminister?(6),Who was Denmark's first female prime minister?,Mette Frederiksen,,Helle Thorning-Schmidt,,Margrethe Vestager,,Helle Thorning-Schmidt,2017 Sommer
Der sidder forældrerepræsentanter i en skolebestyrelse. Sidder der også elevrepræsentanter?,There are parent representatives on a school board. Are there also student representatives?,Ja,Yes,Nej,No,,,Ja,2017 Sommer
Hvilken organisation arbejder blandt andet for fri handel mellem medlemslandene?,"Which organization works, among other things, for free trade between member countries?",NATO,,FN,United Nations,EU,,EU,2017 Sommer
Kan udlændinge stemme til folketingsvalg i Danmark?,Can foreigners vote in parliamentary elections in Denmark?,Ja,Yes,Nej,No,,,Nej,2017 Sommer
"Har mænd normalt ret til at tage fædreorlov, når de er blevet fædre?",Are men usually entitled to take paternity leave after becoming fathers?,Ja,Yes,Nej,No,,,Ja,2017 Sommer
"Hvem bestemmer, hvem der skal danne regering efter et valg?",,Dronningen,,Folketinget,,Domstolene,,Folketinget,2016 Vinter
Hvilken organisation blev Danmark medlem af i 1949?,,FN,,NATO,,EU,,NATO,2016 Vinter
Hvem vælger en tillidsrepræsentant på en arbejdsplads?(6),,Medarbejderne,,Medarbejderne og arbejdsgiveren i forening,,Arbejdsgiveren,,Medarbejderne,2016 Vinter
Hvornår er man ifølge loven myndig i Danmark?(3),,Når man er 15 år,,Når man er 18 år,,Når man er 21 år,,Når man er 18 år,2016 Vinter
Hvad hedder farvandet mellem Jylland og Fyn?(5),,Øresund,,Storebælt,,Lillebælt,,Lillebælt,2016 Vinter
Er det gratis at være medlem af en fagforening?(2),,Ja,,Nej,,,,Nej,2016 Vinter
"Skal man underrette politiet, før man holder en demonstration?",,Ja,,Nej,,,,Ja,2016 Vinter
Er det normalt gratis for voksne borgere at gå til læge i Danmark?,,Ja,,Nej,,,,Ja,2016 Vinter
"Må man danne en forening, hvis man ikke er dansk statsborger?(5)",,Ja,,Nej,,,,Ja,2016 Vinter
Hvem har den dømmende magt?(4),,Regeringen,,Domstolene,,Folketinget,,Domstolene,2016 Vinter
Hvem har ansvaret for de offentlige vuggestuer?,,Kommunerne,,Regionerne,,Staten,,Kommunerne,2016 Vinter
Hvilken af følgende virksomheder producerer vindmøller?(5),,Novo Nordisk,,Vestas,,Mærsk,,Vestas,2016 Vinter
Hvad er normalt den almindelige ugentlige arbejdstid ved et fuldtidsarbejde?,,27 timer om ugen,,37 timer om ugen,,47 timer om ugen,,37 timer om ugen,2016 Vinter
Hvordan er stemmeprocenten normalt i Danmark ved valg til Europa-Parlamentet?,,På samme niveau som ved folketingsvalg,,Højere end ved folketingsvalg,,Lavere end ved folketingsvalg,,Lavere end ved folketingsvalg,2016 Vinter
Skal Folketingets medlemmer være medlem af et politisk parti?(2),,Ja,,Nej,,,,Nej,2016 Vinter
Hvilket år blev reformationen gennemført i Danmark?,,1066,,1397,,1536,,1536,2016 Vinter
Hvad er en straffeattest?(5),,"Et dokument, man skal vise til politiet, hvis man bliver anholdt",,"Et dokument, man skal udfylde, hvis man ønsker at blive dansk statsborger",,"Et dokument, der viser, om man har været straffet",,"Et dokument, der viser, om man har været straffet",2016 Vinter
Hvor mange års undervisningspligt har danske børn?(3),,7 år,,10 år,,13 år,,10 år,2016 Vinter
Hvad er den højeste karakter på 7-trins-skalaen?(3),,7,,10,,12,,12,2016 Vinter
Hvornår levede forfatteren H.C. Andersen?(5),,1805-1875,,1855-1925,,1905-1975,,1805-1875,2016 Vinter
"Mange retssager afgøres i Byretten. Hvor kan man anke en afgørelse herfra, som man er uenig i?",,Landsretten,,Højesteret,,,,Landsretten,2016 Vinter
Er undervisningen gratis på de offentlige gymnasier?(5),,Ja,,Nej,,,,Ja,2016 Vinter
Hvornår blev Danmark under 2. Verdenskrig besat af tyske tropper?(2),,April 1937,,April 1940,,April 1945,,April 1940,2016 Vinter
Hvornår fik Danmark for første gang en kvindelig statsminister?(3),,1991,,2001,,2011,,2011,2016 Vinter
Hvilken kristen højtid fejres 7 uger efter påsken?,,St. Bededag,,Pinse,,Sankt Hans,,Pinse,2016 Vinter
