Emne,Praesentation,Subject,Presentation,Period
"Emne: Sundhed i Danmark med fokus på kost og motion","Hej. I dag vil jeg gerne tale om sundhed i Danmark. Jeg vil især fokusere på kost og motion, fordi det betyder meget for danskernes hverdag. Det er et emne, som mange mennesker diskuterer lige nu.

Først vil jeg tale om kost. Mange danskere går meget op i at spise sundt. De officielle kostråd i Danmark siger, at vi skal spise flere grøntsager, mere fisk og mindre kød. Alligevel er det ikke alle, der følger rådene. I en travl hverdag køber mange mennesker færdigretter, som ofte indeholder for meget sukker og fedt. Desuden er fastfood blevet meget populært blandt de unge, fordi det er hurtigt og nemt. Det er et stort problem for folkesundheden.

Dernæst vil vi se på motion. Generelt er danskerne et meget aktivt folkefærd. Rigtig mange cykler til arbejde eller skole, hvilket er en god form for hverdagsmotion. Derudover er det populært at gå i fitnesscenter eller gå ture i naturen sammen med familien. Men der er også en udfordring. Mange voksne har et stillesiddende arbejde, hvor de sidder foran en computer hele dagen. Det kan føre til rygproblemer og livsstilssygdomme.

Til sidst vil jeg sige, at Danmark gør meget for sundheden, men der er stadig plads til forbedring. Det er vigtigt, at staten gør det billigere at købe sunde madvarer, så alle har råd til at leve sundt. Hvis vi gør det, kan vi få et sundere samfund i fremtiden.

Tak fordi I lyttede.","Topic: Health in Denmark with a focus on diet and exercise","Hello. Today I would like to talk about health in Denmark. I would especially like to focus on diet and exercise because it is very important to the everyday lives of Danes. It is a topic that many people are discussing right now.

First, I would like to talk about diet. Many Danes are very keen on eating healthy. The official dietary guidelines in Denmark say that we should eat more vegetables, more fish and less meat. However, not everyone follows the advice. In a busy everyday life, many people buy ready-made meals, which often contain too much sugar and fat. In addition, fast food has become very popular among young people because it is quick and easy. This is a big problem for public health.

Next, we will look at exercise. In general, Danes are a very active people. Many people cycle to work or school, which is a good form of everyday exercise. In addition, it is popular to go to the gym or go for walks in nature with the family. But there is also a challenge. Many adults have a sedentary job where they sit in front of a computer all day. This can lead to back problems and lifestyle diseases.

Finally, I would like to say that Denmark is doing a lot for health, but there is still room for improvement. It is important that the state makes it cheaper to buy healthy food, so that everyone can afford to live a healthy life. If we do that, we can have a healthier society in the future.

Thank you for listening.","*2 Min. Presentation"
"Hvad gør du selv for at holde dig sund?","Jeg prøver at cykle så meget som muligt i hverdagen. Desuden forsøger jeg at spise grøntsager hver dag og drikke meget vand. Men i weekenden kan jeg godt lide at slappe af og spise lidt slik.","What do you do yourself to stay healthy?","I try to cycle as much as possible during the day. I also try to eat vegetables every day and drink a lot of water. But on the weekend I like to relax and eat some sweets.","*2 Min. Presentation"
"Tror du, det er sværere for unge mennesker at leve sundt i dag end før i tiden?","Ja, det tror jeg. I dag bruger unge mange timer foran en skærm, for eksempel med telefoner eller computerspil. Derfor bevæger de sig mindre. Der er også mere reklame for fastfood nu.","Do you think it is harder for young people to live healthy today than in the past?","Yes, I think so. Today, young people spend many hours in front of a screen, for example with phones or computer games. That's why they move less. There is also more advertising for fast food now.","*2 Min. Presentation"
"Hvad kan politikerne gøre for at forbedre folkesundheden?","Politikerne kan gøre sunde madvarer som frugt og grønt billigere ved at fjerne afgifter. De kan også lave flere cykelstier og støtte sportsklubber, så det bliver nemmere for alle at dyrke motion.","What can politicians do to improve public health?","Politicians can make healthy foods like fruits and vegetables cheaper by removing taxes. They can also create more bike paths and support sports clubs, making it easier for everyone to exercise.","*2 Min. Presentation"
"[Gratis adgang til kulturinstitutioner]Hvorfor tror du, at børn ofte får gratis adgang eller rabat til kulturinstitutioner som museer og teatre?","Jeg tror, at børn får gratis adgang eller rabat, fordi det er vigtigt, at de lærer om kultur og historie fra en ung alder. Hvis det er gratis eller billigt, har alle familier råd til at tage af sted, uanset hvor mange penge de har. Det hjælper også med at skabe gode vaner, så børnene fortsætter med at besøge museer og teatre, når de bliver voksne. På den måde investerer samfundet i fremtiden.","[Free admission to cultural institutions]Why do you think children often get free admission or discounts to cultural institutions like museums and theaters?","I think children get free admission or discounts because it is important for them to learn about culture and history from a young age. If it is free or cheap, all families can afford to go, no matter how much money they have. It also helps create good habits, so the children continue to visit museums and theaters when they become adults. In that way, society is investing in the future.","Støtte Til Kultur"
"[Gratis adgang til kulturinstitutioner]Synes du, det er en god idé at tage børn med på museum? Hvorfor?/Hvorfor ikke?","Ja, jeg synes, det er en rigtig god idé at tage børn med på museum. For det første lærer de meget om historie og kunst på en spændende måde, fordi de kan se tingene i virkeligheden. 

For det andet giver det familier en god oplevelse sammen, hvor man kan tale om vigtige emner. Selvom nogle børn synes, det er kedeligt i starten, kan mange museer i dag gøre det sjovt med aktiviteter for børn.","[Free admission to cultural institutions]Do you think it is a good idea to take children to museums? Why?/Why not?","Yes, I think it is a very good idea to take children to museums. Firstly, they learn a lot about history and art in an exciting way, because they can see things in real life. 

Secondly, it gives families a good experience together, where you can talk about important topics. Even though some children think it is boring at first, many museums today manage to make it fun with activities for children.","Støtte Til Kultur"
"[Statsstøtte til danske film]Hvorfor tror du, at kunstnere får støtte fra staten til at lave film i Danmark?","Jeg tror, at staten støtter danske film, fordi Danmark er et lille land med et lille sprog. Hvis der ikke var statsstøtte, ville det være meget svært for danske film at konkurrere med store Hollywood-film. Støtten sikrer, at vi kan lave film på dansk, som handler om vores egen kultur, historie og værdier. Det hjælper med at bevare den danske identitet, og det giver også unge talenter en chance for at udvikle sig.","[State subsidy for Danish films]Why do you think artists get support from the state to make films in Denmark?","I think the state supports Danish films because Denmark is a small country with a small language. If there were no state subsidies, it would be very difficult for Danish films to compete with big Hollywood movies. The support ensures that we can make films in Danish that are about our own culture, history, and values. It helps preserve the Danish identity, and it also gives young talents a chance to develop.","Støtte Til Kultur"
"[Statsstøtte til danske film]Synes du, det er vigtigt, at staten støtter danske film? Hvorfor?/Hvorfor ikke?","Ja, jeg synes, det er meget vigtigt, at staten støtter danske film. For det første hjælper det med at beskytte det danske sprog og den danske kultur, fordi vi er et lille land. Hvis staten ikke gav penge, ville de fleste mennesker nok kun se amerikanske film. For det andet giver det mulighed for at fortælle historier, som er vigtige for os, der bor i Danmark. Det behøver ikke kun at handle om at tjene penge, men om at lave god kunst.","[State subsidy for Danish films]Do you think it is important that the state supports Danish films? Why?/Why not?","Yes, I think it is very important that the state supports Danish films. Firstly, it helps protect the Danish language and Danish culture because we are a small country. If the state did not give money, most people would probably only watch American films. Secondly, it makes it possible to tell stories that are important to those of us who live in Denmark. It does not only have to be about making money, but about making good art.","Støtte Til Kultur"
"Nogle kommuner vælger at bruge mange penge på store, internationale sportsbegivenheder. Hvilke fordele og ulemper mener du, der kan være ved det for kommunerne?","En stor fordel er, at det skaber liv i byen og tiltrækker mange turister, som bruger penge på hoteller og restauranter. Det kan også gøre kommunen kendt i udlandet og give borgerne en god fælles oplevelse. En ulempe er dog, at det er utroligt dyrt. Hvis kommunen bruger for mange penge på sport, kan der mangle penge til andre vigtige ting, som for eksempel folkeskoler, ældrepleje eller lokal kultur.","Some municipalities choose to spend a lot of money on large, international sports events. What advantages and disadvantages do you think there can be for the municipalities?","A big advantage is that it creates life in the city and attracts many tourists who spend money on hotels and restaurants. It can also make the municipality well-known abroad and give the citizens a great shared experience. However, a disadvantage is that it is incredibly expensive. If the municipality spends too much money on sports, there might be a lack of money for other important things, such as public schools, elderly care, or local culture.","Støtte Til Kultur"
"Synes du, at kommuner bør prioritere andre områder som børnepasning og ældrepleje frem for store sportsbegivenheder? Hvorfor?/Hvorfor ikke?","Ja, det synes jeg. Efter min mening er det vigtigere at bruge penge på børnepasning og ældrepleje, fordi det handler om borgernes basale velfærd og hverdag. Hvis de ældre ikke får en god pleje, eller hvis der mangler pædagoger i vuggestuerne, rammer det mange familier hårdt. Store sportsbegivenheder er sjove og spændende, men de varer kun i kort tid. Velfærd er noget, vi har brug for hver evig eneste dag.","Do you think that municipalities should prioritize other areas like childcare and elderly care over large sports events? Why?/Why not?","Yes, I think so. In my opinion, it is more important to spend money on childcare and elderly care because it is about the citizens' basic welfare and everyday lives. If the elderly do not get good care, or if there is a shortage of educators in nurseries, it hits many families hard. Large sports events are fun and exciting, but they only last for a short time. Welfare is something we need each and every day.","Støtte Til Kultur"
"[Uro i Klassen]Hvorfor tror du, der er meget uro i nogle folkeskoleklasser?","Jeg tror, der er meget uro, fordi klasserne ofte er meget store, og eleverne er meget forskellige. Det kan være svært for én lærer at hjælpe alle på samme tid. Hvis nogle elever keder sig, eller hvis opgaverne er for svære, begynder de måses at larme eller snakke med sidemanden. Desuden bruger mange børn meget tid foran en skærm i dag, og det kan gøre det sværere for dem at sidde stille og koncentrere sig i skolen.","[Noise in the Classroom]Why do you think there is a lot of noise and unrest in some public school classrooms?","I think there is a lot of noise because classes are often very large, and the students are very different. It can be difficult for one teacher to help everyone at the same time. If some students are bored, or if the assignments are too difficult, they might start making noise or talking to the person next to them. Furthermore, many children spend a lot of time in front of a screen nowadays, and that can make it harder for them to sit still and concentrate in school.","Pædagogik i folkeskolen"
"[Uro i Klassen]Hvad mener du, lærerne kan gøre for at begrænse uroen i klasserne?","Jeg mener, at lærerne kan gøre flere ting. For det første er det vigtigt at have klare regler for, hvordan man opfører sig i klassen, så alle elever ved, hvad de skal gøre. For det andet kan lærerne lave mere varieret undervisning, hvor eleverne ikke kun skal sidde stille, men også bevæge sig eller arbejde i grupper. Endelig er det en god idé at opbygge et godt forhold til eleverne, fordi det skaber mere respekt og ro.","[Noise in the Classroom]What do you think teachers can do to limit the noise and unrest in classrooms?","I think that teachers can do several things. Firstly, it is important to have clear rules for how to behave in class, so all students know what to do. Secondly, teachers can create more varied teaching, where students do not just have to sit still, but also move around or work in groups. Finally, it is a good idea to build a good relationship with the students, because it creates more respect and quiet.","Pædagogik i folkeskolen"
"[Forskellige Undervisningsmetoder]Hvorfor tror du, at nogle lærere vælger kreative undervisningsmetoder som gruppearbejde og projekter?","Jeg tror, at lærere bruger kreative metoder, fordi det gør undervisningen mere spændende for eleverne. Når man arbejder i grupper eller med projekter, lærer børnene at samarbejde og løse problemer sammen. Det giver også plads til, at eleverne kan være aktive i stedet for bare at lytte til læreren i lang tid. På den måde husker de ofte det, de har lært, meget bedre.","[Different Teaching Methods]Why do you think some teachers choose creative teaching methods like group work and projects?","I think teachers use creative methods because it makes teaching more exciting for the students. When working in groups or with projects, children learn to cooperate and solve problems together. It also allows the students to be active instead of just listening to the teacher for a long time. In that way, they often remember what they have learned much better.","Pædagogik i folkeskolen"
"[Forskellige Undervisningsmetoder]Mener du, det er vigtigt at bruge forskellige undervisningsmetoder? Hvorfor?/Hvorfor ikke?","Ja, jeg mener, det er meget vigtigt at bruge forskellige undervisningsmetoder. Børn lærer på forskellige måder; nogle lærer bedst ved at læse, mens andre lærer bedst ved at lytte eller lave noget praktisk. Hvis læreren varierer undervisningen, kan alle elever være med og forstå stoffet. Det gør også skoledagen mere spændende, så eleverne ikke mister koncentrationen og keder sig.","[Different Teaching Methods]Do you think it is important to use different teaching methods? Why?/Why not?","Yes, I think it is very important to use different teaching methods. Children learn in different ways; some learn best by reading, while others learn best by listening or doing something practical. If the teacher varies the teaching, all students can participate and understand the material. It also makes the school day more exciting, so the students do not lose concentration and get bored.","Pædagogik i folkeskolen"
"Nogle mener, at der bør bruges flere penge på folkeskolen for at ansætte flere lærere. Hvilke fordele og ulemper mener du, der kan være ved det?","En stor fordel er, at der bliver flere voksne til at hjælpe eleverne. Når der er to lærere i en klasse, eller hvis klasserne bliver mindre, får den enkelte elev mere opmærksomhed. Det kan give mere ro og bedre indlæring. 

En ulempe er dog, at det koster rigtig mange penge for samfundet. Hvis man bruger flere penge på skolerne, skal man måske spare på andre vigtige områder som sundhedsvæsenet eller ældreplejen.","Some believe that more money should be spent on the public school system to hire more teachers. What advantages and disadvantages do you think there could be to that?","A big advantage is that there will be more adults to help the students. When there are two teachers in a class, or if classes become smaller, each individual student gets more attention. This can result in more quiet and better learning. 

However, a disadvantage is that it costs a lot of money for society. If more money is spent on schools, it might be necessary to save on other important areas like the healthcare system or elderly care.","Pædagogik i folkeskolen"
"Synes du, at penge brugt på folkeskolen er en god investering? Hvorfor?/Hvorfor ikke?","Ja, jeg synes, at penge brugt på folkeskolen er en rigtig god investering. Børnene er jo vores fremtid, og det er vigtigt, at de får en god uddannelse fra starten. Hvis skolerne har gode lærere og materialer, lærer børnene mere, og de klarer sig bedre senere i livet. Det betyder, at de kan få gode job og bidrage til samfundet, når de bliver voksne. Derfor betaler pengene sig tilbage i sidste ende.","Do you think that money spent on the public school system is a good investment? Why?/Why not?","Yes, I think that money spent on public schools is a very good investment. After all, children are our future, and it is important that they get a good education from the start. If schools have good teachers and materials, children learn more, and they do better later in life. This means they can get good jobs and contribute to society when they become adults. Therefore, the money pays itself back in the end.","Pædagogik i folkeskolen"
"[Mangel på arbejdskraft i sundhedssektoren]Hvorfor tror du, der mangler arbejdskraft i sundhedssektoren, fx sygeplejersker og social- og sundhedsassistenter?","Jeg tror, der mangler arbejdskraft, fordi arbejdet i sundhedssektoren ofte er meget hårdt og stressende. Sygeplejersker og assistenter skal løbe stærkt, og de har mange skæve arbejdstider, som for eksempel nattevagter og weekendarbejde. Desuden synes mange, at lønnen er for lav i forhold til det store ansvar, de har. Det gør, at færre unge vælger uddannelsen, og nogle forlader faget for at finde et andet job.","[Labor shortage in the healthcare sector]Why do you think there is a shortage of labor in the healthcare sector, for example, nurses and social and healthcare assistants?","I think there is a shortage of labor because work in the healthcare sector is often very hard and stressful. Nurses and assistants have to run fast, and they have many awkward working hours, such as night shifts and weekend work. Furthermore, many people think that the salary is too low compared to the big responsibility they have. This means that fewer young people choose the education, and some leave the profession to find another job.","Mangel på arbejdskraft"
"[Klima og livsstil / At vælge en klimavenlig livsstil]Hvorfor tror du, at nogle vælger at leve klimavenligt, fx ved at spise mindre kød eller tage offentlig transport?","Jeg tror, at mange vælger at leve klimavenligt, fordi de er bekymrede for fremtiden og klimaforandringerne. De vil gerne gøre en personlig forskel for at passe på planeten og mindske CO2-udledningen. 

Derudover er det blevet meget moderne at leve grønt, og der er kommet mange gode alternativer, som for eksempel lækker vegetarmad og bedre offentlig transport. Nogle gør det også for at spare penge eller for at leve sundere.","[Climate and lifestyle / Choosing a climate-friendly lifestyle]Why do you think some people choose to live in a climate-friendly way, for example by eating less meat or taking public transportation?","I think many people choose to live in a climate-friendly way because they are worried about the future and climate change. They want to make a personal difference to take care of the planet and reduce CO2 emissions. 

In addition, living green has become very fashionable, and many good alternatives have emerged, such as delicious vegetarian food and better public transportation. Some also do it to save money or to live healthier.","Klima og livsstil"
"[Klima og livsstil / At vælge en klimavenlig livsstil]Hvad tror du, det betyder for miljøet, hvis flere lever klimavenligt?","","","","Klima og livsstil"
"[Klima og livsstil / At ignorere klimaudfordringer]Hvorfor tror du, at nogle mennesker ikke ændrer deres livsstil, selvom de ved, at klimaet er under pres?","","","","Klima og livsstil"
"[Klima og livsstil / At ignorere klimaudfordringer]Hvordan kan samfundet opmuntre folk til at tage mere hensyn til klimaet?","","","","Klima og livsstil"
"[Klima og livsstil / At ignorere klimaudfordringer]Nogle mener, at vi skal betale mere i skat for at finansiere klimainitiativer. Hvilke fordele og ulemper mener du, der kan være ved det?","","","","Klima og livsstil"
"[Mangel på arbejdskraft i sundhedssektoren]Hvilke problemer mener du, der kan være ved, at der mangler sygeplejersker og social og sundhedsassistenter?","","","","Mangel på arbejdskraft"
"[Mangel på arbejdskraft i byggebranchen]Hvorfor tror du, der mangler arbejdskraft i byggebranchen, fx tømrere og betonarbejdere?","","","","Mangel på arbejdskraft"
"[Mangel på arbejdskraft i byggebranchen]Hvilke problemer mener du, der kan være ved, at der mangler arbejdskraft inden for byggebranchen?","","","","Mangel på arbejdskraft"
"Ved mangel på arbejdskraft kan man gøre det nemmere at rekruttere udenlandsk arbejdskraft. Hvilke fordele og ulemper mener du, der kan være ved det for samfundet?","","","","Mangel på arbejdskraft"
"Mener du, det er i orden at rekruttere udenlandsk arbejdskraft, selvom der er arbejdsløse i Danmark? Hvorfor?/Hvorfor ikke?","","","","Mangel på arbejdskraft"
"[At søge læge ved små problemer]Hvorfor tror du, at nogle vælger at gå til lægen, selvom deres problemer ikke er alvorlige?","","","","At Søge Læge"
"[At søge læge ved små problemer]Kan der være nogen problemer ved, at folk går til lægen for små problemer?","","","","At Søge Læge"
"[At undgå lægebesøg]Hvorfor tror du, at nogle undgår at gå til lægen, selvom de har helbredsproblemer?","","","","At Søge Læge"
"[At undgå lægebesøg]Hvad kan det betyde for en persons helbred, hvis de undgår at gå til lægen?","","","","At Søge Læge"
"I nogle lande betaler man for at gå til lægen. Hvilke fordele og ulemper mener du, der kan være ved det?","","","","At Søge Læge"
"Synes du, at lægehjælp skal være gratis for alle? Hvorfor?/Hvorfor ikke?","","","","At Søge Læge"
"[A-obl. Mænd venter med at gå til læge]Der er en tendens til,  at mænd venter længere end kvinder med at gå til læge, selvom de ikke føler sig helt raske. Hvorfor tror du, det er sådan?","Jeg tror, det handler om kultur og traditioner. Mange mænd har lært, at de skal være stærke og klare sig selv. De vil ikke virke svage eller klage over smerte. Nogle mænd er måske også bange for, hvad lægen vil sige, eller også tænker de bare, at problemet går væk af sig selv. Kvinder er ofte bedre til at lytte til deres krop og tale om helbred med andre.","[Men wait to see a doctor]There is a tendency for men to wait longer than women to see a doctor, even if they don't feel completely well. Why do you think this is the case?","I think it is about culture and traditions. Many men have learned that they need to be strong and manage on their own. They do not want to seem weak or complain about pain. Some men might also be afraid of what the doctor will say, or they just think that the problem will go away by itself. Women are often better at listening to their body and talking about health with others.","10.06-At Søge Læge 2023 Vinter"
"[A-opf. Mænd venter med at gå til læge]Mener du, der kan være nogen problemer ved, at man venter lidt med at gå til læge, selvom man ikke føler sig helt rask?","Ja, det mener jeg bestemt. Hvis man venter for længe, kan en lille sygdom nå at blive meget værre og sværere at behandle. For eksempel kan alvorlige sygdomme som kræft eller hjerteproblemer opdages for sent. 

Det kan også betyde, at man skal være sygemeldt fra sit arbejde i længere tid, hvilket påvirker både en selv og samfundet. Så det er altid bedst at reagere i tide.","[Men wait to see a doctor]Do you think there might be any problems with waiting a little to see a doctor, even if you don't feel completely well?","Yes, I definitely think so. If you wait too long, a small illness can manage to become much worse and harder to treat. For example, serious illnesses like cancer or heart problems might be discovered too late. 

It can also mean that you have to be on sick leave from your job for a longer time, which affects both yourself and society. So it is always best to react in time.","10.06-At Søge Læge 2023 Vinter"
